{
  "channel": "stable",
  "version": "1.0.0",
  "updated_at": "2026-08-06T19:41:00Z",
  "runtime": {
    "file": "runtime/runtime.v1.0.0.js",
    "hash": "sha256-placeholder",
    "min_loader_version": "1.0.0"
  },
  "modules": {
    "ui-styles": {
      "file": "modules/ui/styles.v1.0.3.js",
      "version": "1.0.3",
      "hash": "sha256-placeholder",
      "depends": []
    },
    "ui-icons": {
      "file": "modules/ui/icons.js",
      "version": "1.0.0",
      "hash": "sha256-placeholder",
      "depends": []
    },
    "ai-prompts": {
      "file": "modules/ai/prompts.js",
      "version": "1.0.0",
      "hash": "sha256-placeholder",
      "depends": []
    },
    "ai-parser": {
      "file": "modules/ai/parser.js",
      "version": "1.0.0",
      "hash": "sha256-placeholder",
      "depends": []
    },
    "ai": {
      "file": "modules/ai/ai.v1.0.0.js",
      "version": "1.0.0",
      "hash": "sha256-placeholder",
      "depends": ["ai-prompts", "ai-parser"]
    },
    "ui": {
      "file": "modules/ui/ui.v1.0.3.js",
      "version": "1.0.3",
      "hash": "sha256-placeholder",
      "depends": ["ui-styles", "ui-icons"]
    },
    "reader": {
      "file": "modules/reader/reader.v1.0.0.js",
      "version": "1.0.0",
      "hash": "sha256-placeholder",
      "depends": []
    },
    "quiz": {
      "file": "modules/quiz/quiz.v1.0.0.js",
      "version": "1.0.0",
      "hash": "sha256-placeholder",
      "depends": ["ai"]
    }
  }
}
